<?xml version="1.0" encoding="UTF-8"?>
<!DOCTYPE elearning SYSTEM "khoahoc.dtd">
<elearning>
    
    <course id="C001" category="Lập trình">
        <title>Python cơ bản</title>
        <duration>40 giờ</duration>
        <price>2000000</price>
        <instructor id="I001">
            <name>Nguyễn Văn A</name>
            <email>nguyenvana@example.com</email>
            <experience>5 năm</experience>
        </instructor>
        <students>
            <student id="S001" progress="80">
                <name>Trần Thị B</name>
                <email>tranthib@gmail.com</email>
                <join_date>2025-01-15</join_date>
            </student>
            <student id="S002" progress="50">
                <name>Hoàng Minh C</name>
                <email>hoangminhc@gmail.com</email>
                <join_date>2025-02-01</join_date>
            </student>
            <student id="S003" progress="95">
                <name>Lê Thị D</name>
                <email>lethid@gmail.com</email>
                <join_date>2025-01-10</join_date>
            </student>
        </students>
    </course>
    
    <course id="C002" category="Thiết kế">
        <title>Adobe Photoshop nâng cao</title>
        <duration>30 giờ</duration>
        <price>1500000</price>
        <instructor id="I002">
            <name>Phạm Thị E</name>
            <email>phamthie@example.com</email>
            <experience>8 năm</experience>
        </instructor>
        <students>
            <student id="S004" progress="70">
                <name>Võ Thanh F</name>
                <email>vothanhf@gmail.com</email>
                <join_date>2025-02-15</join_date>
            </student>
            <student id="S005" progress="85">
                <name>Đặng Minh G</name>
                <email>dangminhg@gmail.com</email>
                <join_date>2025-01-20</join_date>
            </student>
        </students>
    </course>
    
    <course id="C003" category="Marketing">
        <title>Digital Marketing từ A-Z</title>
        <duration>50 giờ</duration>
        <price>2500000</price>
        <instructor id="I003">
            <name>Trịnh Văn H</name>
            <email>trinhvanh@example.com</email>
            <experience>10 năm</experience>
        </instructor>
        <students>
            <student id="S006" progress="30">
                <name>Bùi Thị I</name>
                <email>buithii@gmail.com</email>
                <join_date>2025-02-28</join_date>
            </student>
        </students>
    </course>
    
</elearning>
